{
  "$schema": "https://json-schema.org/draft/2020-12/schema",
  "title": "Keten",
  "description": "De nodes en edges op de paden tussen een node en de politieke input waar die uit voortkomt.",
  "type": "object",
  "properties": {
    "start": {
      "type": "string",
      "format": "uri",
      "description": "URI van de node waarvoor de keten is opgevraagd."
    },
    "peildatum": {
      "type": "string",
      "format": "date",
      "description": "Datum waarop titels en statussen gelden."
    },
    "nodes": {
      "type": "array",
      "description": "Nodes in de keten uit dit corpus, inclusief de startnode.",
      "items": {
        "$ref": "node.schema.json"
      }
    },
    "edges": {
      "type": "array",
      "description": "Edges tussen de nodes in de keten.",
      "items": {
        "$ref": "edge.schema.json"
      }
    },
    "external_node_uris": {
      "type": "array",
      "description": "URIs van nodes uit een ander corpus waar de keten naar verwijst. Die worden bij dat corpus opgehaald.",
      "items": {
        "type": "string",
        "format": "uri"
      }
    },
    "complete": {
      "type": "boolean",
      "description": "False als de keten is afgekapt op de maximale diepte."
    }
  },
  "required": [
    "start",
    "peildatum",
    "nodes",
    "edges",
    "complete"
  ]
}
