{
  "start": "https://corpus.voorbeeldministerie.example/id/node/0b6f1c1e-5a0e-4a53-9a43-0d3e1d6b2a03",
  "peildatum": "2026-07-01",
  "nodes": [
    {
      "uri": "https://corpus.voorbeeldministerie.example/id/node/0b6f1c1e-5a0e-4a53-9a43-0d3e1d6b2a03",
      "type": "instrument",
      "title": "Opdracht bouwsteen Alfa",
      "description": null,
      "status": "actief",
      "managing_organisation": null,
      "corpus": "https://corpus.voorbeeldministerie.example",
      "peildatum": "2026-07-01",
      "type_details": {
        "soort": "overig"
      }
    },
    {
      "uri": "https://corpus.voorbeeldministerie.example/id/node/0b6f1c1e-5a0e-4a53-9a43-0d3e1d6b2a02",
      "type": "doel",
      "title": "Overheidsdiensten hergebruiken gedeelde bouwstenen",
      "description": "Fictief doel.",
      "status": "actief",
      "validity": {
        "start_date": "2026-01-01",
        "end_date": null
      },
      "managing_organisation": {
        "tooi_uri": "https://identifier.overheid.nl/tooi/id/ministerie/mnre0000",
        "name": "Voorbeeldministerie"
      },
      "corpus": "https://corpus.voorbeeldministerie.example",
      "peildatum": "2026-07-01"
    },
    {
      "uri": "https://corpus.voorbeeldministerie.example/id/node/0b6f1c1e-5a0e-4a53-9a43-0d3e1d6b2a01",
      "type": "politieke_input",
      "title": "Motie over hergebruik van digitale bouwstenen",
      "description": null,
      "status": "actief",
      "validity": {
        "start_date": "2025-11-04",
        "end_date": null
      },
      "managing_organisation": {
        "tooi_uri": "https://identifier.overheid.nl/tooi/id/ministerie/mnre0000",
        "name": "Voorbeeldministerie"
      },
      "corpus": "https://corpus.voorbeeldministerie.example",
      "peildatum": "2026-07-01",
      "type_details": {
        "soort": "motie",
        "referentie": "00000-00",
        "datum": "2025-11-04"
      }
    }
  ],
  "edges": [
    {
      "from": "https://corpus.voorbeeldministerie.example/id/node/0b6f1c1e-5a0e-4a53-9a43-0d3e1d6b2a03",
      "to": "https://corpus.voorbeeldministerie.example/id/node/0b6f1c1e-5a0e-4a53-9a43-0d3e1d6b2a02",
      "type": "implementeert"
    },
    {
      "uri": "https://corpus.voorbeeldministerie.example/id/edge/5e0a7f10-aaaa-4bbb-8ccc-000000000001",
      "from": "https://corpus.voorbeeldministerie.example/id/node/0b6f1c1e-5a0e-4a53-9a43-0d3e1d6b2a01",
      "to": "https://corpus.voorbeeldministerie.example/id/node/0b6f1c1e-5a0e-4a53-9a43-0d3e1d6b2a02",
      "type": "draagt_bij_aan",
      "description": null
    },
    {
      "from": "https://corpus.voorbeeldministerie.example/id/node/0b6f1c1e-5a0e-4a53-9a43-0d3e1d6b2a02",
      "to": "https://corpus.anderministerie.example/id/node/7c1d2f3a-1111-4222-8333-444455556666",
      "type": "draagt_bij_aan",
      "description": "Verwijzing naar een doel in een ander corpus."
    }
  ],
  "external_node_uris": [
    "https://corpus.anderministerie.example/id/node/7c1d2f3a-1111-4222-8333-444455556666"
  ],
  "complete": true
}
